{
  "accent_stroke_count": 0,
  "calibration_sheet_digest": "338a7cbf17cc03814da7eb5ebab74d78d304d0d6d4dd69f01e40399e808c19ac",
  "confirmation_stroke_count": 0,
  "decision": "advance",
  "drawing_artifact_sha256": "6464d1c0dafbf59b1ba0a1f65fe3d4110ab1eccb51ec4616bfea4ff968c6fc0f",
  "drawing_state_sha256": "ec78af0027e2926eea46e9c18d4f37081d0c1379d2720cd30ce1d202fd3d61a6",
  "evaluator_id": "fresh-worker-independent-review",
  "evidence_refs": [
    "reviews/P6_identity_finish/pass_01/current_drawing.png",
    "identity/calibration_sheet.json"
  ],
  "face_relation": "Face opening, eye line, nose and mouth remain inside grouped hair.",
  "fold_stroke_count": 2,
  "garment_mark_count": 2,
  "hair_group_count": 2,
  "history_cursor": 45,
  "identity_stroke_count": 4,
  "observation_lock_digest": "99ac13ecb229547fabecd3ca6a6b87d1cc2a936b288ee4f99970de514fc9d47e",
  "profile": {
    "allowed_roles": [
      "identity",
      "form",
      "accent",
      "fold",
      "restatement"
    ],
    "max_accent_fraction": 0.25,
    "max_confirmation_strokes": 12,
    "max_identity_strokes": 48,
    "max_micro_fold_strokes": 8,
    "profile_id": "p6_selective_identity_v1",
    "require_calibration": true,
    "schema": "img2drawing.identity_finish_profile.v1"
  },
  "rationale": "Bounded identity finish accepted after face/hair and garment crops were inspected.",
  "schema": "img2drawing.identity_finish_manifest.v1"
}